<?xml version="1.0" encoding='UTF-8'?>
<!DOCTYPE MessageFile SYSTEM "../org.eclipse.rse.ui/messageFile.dtd">
<!-- This is a message file used by SystemMessage and SystemMessageDialog -->
<MessageFile Version="1.0">
	<Component Name="RSE Samples" Abbr="RSS">
		<Subcomponent Name="General" Abbr="G">
			<MessageList>
				<Message ID="1001" Indicator="E">
					<LevelOne>Sample message</LevelOne>		
					<LevelTwo>This is a sample with one substution variable: %1</LevelTwo>
				</Message>
				<Message ID="1002" Indicator="I">
					<LevelOne>Processing...</LevelOne>
					<LevelTwo></LevelTwo>
				</Message>
			</MessageList>
		</Subcomponent>
	</Component>
</MessageFile>
